{
  "audit_date": "2026-07-31",
  "features": [
    {
      "acceptance_class": "required_local",
      "advertised": [
        "short-video retrieval",
        "visual question answering",
        "VLM report generation",
        "templated reports",
        "large-file chunked upload",
        "local/shared/remote model layouts",
        "public media URL rewriting",
        "Agent configuration file and LLM schema",
        "Agent MCP client transport and include contract",
        "Agent custom functions and MCP extension points",
        "Agent pluggable knowledge-retrieval backends",
        "Agent top-level and report sub-agent hierarchy",
        "Base, LVS, and search report-generation profile contracts",
        "Agent report output and persistence contract",
        "Agent audio, restart, timestamp, and empty-chart known issues",
        "Agent production and direct developer operating modes",
        "Base chat, follow-up, and report workflow",
        "Base report HITL command state machine"
      ],
      "category": "workflow",
      "gap": "The 3.2.1 agent and production UI images are staged; repeat upload, Q&A, report, URL, restart, and deletion tests on the current runtime. Wave 2 also requires field-level Agent configuration, MCP resolution, profile-specific report persistence, hierarchy, known-issue, and semantic report oracles before current-runtime qualification. Wave 3 adds reviewed planning-only contracts from the complete candidate registry; no new runtime pass evidence is implied.",
      "id": "base-agent-workflow",
      "official_capability_ids": [
        "configuration.agent.file-llm-schema",
        "configuration.agent.mcp-client",
        "configuration.agent.extension-points",
        "configuration.agent.knowledge-retrieval-backends",
        "configuration.agent.hierarchy",
        "runtime.agent.report-profile-contracts",
        "runtime.agent.report-artifacts",
        "behavior.agent.known-issues",
        "runtime.agent.operational-modes",
        "runtime.workflow.base-chat-report",
        "runtime.agent.base-hitl",
        "manifest-entry.base-agent-workflow.00-short-video-retrieval",
        "manifest-entry.base-agent-workflow.01-visual-question-answering",
        "manifest-entry.base-agent-workflow.02-vlm-report-generation",
        "manifest-entry.base-agent-workflow.03-templated-reports",
        "manifest-entry.base-agent-workflow.04-large-file-chunked-upload",
        "manifest-entry.base-agent-workflow.05-local-shared-remote-model-layouts",
        "manifest-entry.base-agent-workflow.06-public-media-url-rewriting"
      ],
      "runtime_state": "not_qualified",
      "source_evidence": [
        "services/agent",
        "deploy/docker/developer-profiles/dev-profile-base"
      ],
      "thor_evidence": [
        "deploy/docker/developer-profiles/dev-profile-thor-full/vss-agent/configs/config.yml",
        "deploy/docker/services/infra/haproxy/haproxy.cfg.template",
        "deploy/docker/thor-local/parity/candidates/wave2/candidate.json",
        "deploy/docker/thor-local/parity/candidates/wave3/bundle/merge-receipt.json"
      ],
      "thor_state": "partial"
    },
    {
      "acceptance_class": "required_local",
      "advertised": [
        "chunked dense captions",
        "file summarization",
        "multi-video report",
        "structured output",
        "object/event/scenario focus",
        "reasoning",
        "partial-video offsets",
        "recommended configuration",
        "Prometheus metrics",
        "LVS Agent profile tool and media contract",
        "LVS request serialization",
        "LVS supported video formats"
      ],
      "category": "workflow",
      "gap": "The 3.2.1 local derivative now includes upstream main's strict Purpose enum and a 422 semantic probe; its exact-patch tests and networkless ARM64 build pass. Prove that semantic response, multi-video single-call routing, and every summarization/report request option on the current runtime. Wave 3 adds reviewed planning-only contracts from the complete candidate registry; no new runtime pass evidence is implied.",
      "id": "video-summarization-file",
      "official_capability_ids": [
        "runtime.agent.lvs-profile",
        "runtime.lvs.single-request-queue",
        "runtime.lvs.supported-formats",
        "manifest-entry.video-summarization-file.00-chunked-dense-captions",
        "manifest-entry.video-summarization-file.01-file-summarization",
        "manifest-entry.video-summarization-file.02-multi-video-report",
        "manifest-entry.video-summarization-file.03-structured-output",
        "manifest-entry.video-summarization-file.04-object-event-scenario-focus",
        "manifest-entry.video-summarization-file.05-reasoning",
        "manifest-entry.video-summarization-file.06-partial-video-offsets",
        "manifest-entry.video-summarization-file.07-recommended-configuration",
        "manifest-entry.video-summarization-file.08-prometheus-metrics"
      ],
      "runtime_state": "not_qualified",
      "source_evidence": [
        "services/video-summarization",
        "deploy/docker/developer-profiles/dev-profile-lvs"
      ],
      "thor_evidence": [
        "deploy/docker/thor-local/Dockerfile.video-summarization",
        "deploy/docker/thor-local/patches/patch_lvs_files_purpose.py",
        "deploy/docker/thor-local/qualification/tests/test_lvs_files_purpose_patch.py",
        "deploy/docker/thor-local/qualification/runtime_inventory.json",
        "deploy/docker/developer-profiles/dev-profile-thor-full/vss-agent/configs/config.yml",
        "deploy/docker/thor-local/parity/evidence/2026-07-31-lvs-main-parity.md",
        "deploy/docker/thor-local/parity/candidates/wave3/bundle/merge-receipt.json"
      ],
      "thor_state": "partial"
    },
    {
      "acceptance_class": "required_local",
      "advertised": [
        "live captions",
        "live stream summaries",
        "stream reports",
        "caption-backed Q&A",
        "Elasticsearch caption storage",
        "SSE MCP server"
      ],
      "category": "workflow",
      "gap": "All 18 LVS HTTP routes and 13 SSE MCP tools, including the four Thor-local file-management adapters, are statically qualified. MCP health tools probe real LVS readiness/liveness, but every tool and the separate dense-caption cache/embedding lanes still require runtime exercise.",
      "id": "video-summarization-live",
      "official_capability_ids": [
        "manifest-entry.video-summarization-live.00-live-captions",
        "manifest-entry.video-summarization-live.01-live-stream-summaries",
        "manifest-entry.video-summarization-live.02-stream-reports",
        "manifest-entry.video-summarization-live.03-caption-backed-q-a",
        "manifest-entry.video-summarization-live.04-elasticsearch-caption-storage",
        "manifest-entry.video-summarization-live.05-sse-mcp-server"
      ],
      "runtime_state": "not_qualified",
      "source_evidence": [
        "services/video-summarization/src",
        "services/video-summarization/src/lvs_mcp.py"
      ],
      "thor_evidence": [
        "deploy/docker/services/video-summarization/compose.yml",
        "deploy/docker/thor-local/Dockerfile.video-summarization",
        "services/video-summarization/tests/test_lvs_mcp.py",
        "deploy/docker/thor-local/qualification/expected/lvs.json",
        "deploy/docker/thor-local/qualification/expected/lvs-mcp.json"
      ],
      "thor_state": "partial"
    },
    {
      "acceptance_class": "required_local",
      "advertised": [
        "natural-language action/event search",
        "CV attribute search",
        "multi-embedding fusion",
        "search by image",
        "follow-up Q&A",
        "query/time/source/count refinement",
        "default critic VLM",
        "file and RTSP archive management",
        "Search Agent route and ranking contract",
        "Search upload Content-Type contract"
      ],
      "category": "workflow",
      "gap": "The 3.2.1 RT-CV/RT-Embed images and Thor engines are staged; re-run text, attribute, fused, critic, follow-up, and image-search cases. Wave 3 adds reviewed planning-only contracts from the complete candidate registry; no new runtime pass evidence is implied.",
      "id": "semantic-search",
      "official_capability_ids": [
        "runtime.agent.search-profile",
        "behavior.search-upload.content-type",
        "manifest-entry.semantic-search.00-natural-language-action-event-search",
        "manifest-entry.semantic-search.01-cv-attribute-search",
        "manifest-entry.semantic-search.02-multi-embedding-fusion",
        "manifest-entry.semantic-search.03-search-by-image",
        "manifest-entry.semantic-search.04-follow-up-q-a",
        "manifest-entry.semantic-search.05-query-time-source-count-refinement",
        "manifest-entry.semantic-search.06-default-critic-vlm",
        "manifest-entry.semantic-search.07-file-and-rtsp-archive-management"
      ],
      "runtime_state": "not_qualified",
      "source_evidence": [
        "deploy/docker/developer-profiles/dev-profile-search",
        "services/ui"
      ],
      "thor_evidence": [
        "deploy/docker/developer-profiles/dev-profile-thor-full/vss-agent/configs/config.yml",
        "deploy/docker/developer-profiles/dev-profile-search/video-analytics-2d-app/compose.yml",
        "deploy/docker/thor-local/parity/candidates/wave3/bundle/merge-receipt.json"
      ],
      "thor_state": "partial"
    },
    {
      "acceptance_class": "required_local",
      "advertised": [
        "configuration up to 100 streams",
        "16 concurrent 1080p streams tested by NVIDIA"
      ],
      "category": "scale",
      "gap": "Thor's qualified envelope is one conservative stream and two supervised demo streams; upstream scale figures are not Thor claims.",
      "id": "search-scale",
      "official_capability_ids": [
        "manifest-entry.search-scale.00-configuration-up-to-100-streams",